{
  "decision_id": "dec-ex-002",
  "entity_id": "vendor-risk-agent",
  "verdict": "INDETERMINATE",
  "coverage": 0.62,
  "truncated": false,
  "reason_codes": ["ambiguous_identity", "coverage_below_threshold"],
  "rationale": {
    "summary": "Entity vendor-risk-agent is INDETERMINATE: unresolved identity ambiguity.",
    "details": [
      "ambiguous_identity: Entity vendor-risk-agent has unresolved identity conflict with: vendor_risk",
      "coverage_below_threshold"
    ],
    "reason_codes": ["ambiguous_identity", "coverage_below_threshold"],
    "blast_radius": { "nodes": ["vendor-db"], "max_depth": 1 },
    "coverage_breakdown": { "trace": 0.55, "agent_framework": 0.40 },
    "suggested_runbook": []
  },
  "limitations_footer": "Limitations: Absence of evidence is not evidence of absence.",
  "as_of": "2026-09-23T10:00:00+00:00",
  "engine_version": "0.1.0",
  "change_type": "retirement",
  "paths": []
}
