{
  "decision_id": "dec-ex-001",
  "entity_id": "invoice-reconciler-agent",
  "verdict": "UNSAFE",
  "coverage": 0.91,
  "truncated": false,
  "reason_codes": ["critical_descendant_reachable"],
  "rationale": {
    "summary": "Entity invoice-reconciler-agent is UNSAFE: critical descendants reachable (2 nodes).",
    "details": ["critical_descendant_reachable"],
    "reason_codes": ["critical_descendant_reachable"],
    "blast_radius": {
      "all_reachable_count": 3,
      "critical_reachable_count": 2,
      "critical_reachable": ["ledger-db", "payment-api"],
      "truncated": false,
      "layer": "possible"
    },
    "coverage_breakdown": {
      "coverage": 0.91,
      "observed_entities": 91,
      "total_entities": 100,
      "suppressed_channels": [],
      "meets_threshold": true,
      "c_min": 0.85
    },
    "suggested_runbook": [
      {
        "stage": "report_and_remediate",
        "description": "Notify owners of blocked retirement due to critical dependents",
        "entity_id": "invoice-reconciler-agent"
      }
    ]
  },
  "limitations_footer": "Limitations: CIRDA decisions reflect observability coverage at evaluation timestamp.",
  "as_of": "2026-09-23T10:00:00+00:00",
  "engine_version": "0.1.0",
  "change_type": "retirement",
  "paths": [
    {
      "path_nodes": ["invoice-reconciler-agent", "ledger-db"],
      "path_confidence": 0.95,
      "is_critical_path": true
    }
  ]
}
